1.400,Vivendi shares closed 1.9 percent at 15.80 euros in Paris after falling 3.6 percent on Monday.,"In New York, Vivendi shares were 1.4 percent down at $18.29."
3.600,Bremer said one initiative is to launch a US$70 million nationwide program in the next two weeks to clean up neighborhoods and build community projects.,"Bremer said he would launch a $70-million program in the next two weeks to clean up neighborhoods across Iraq and build community projects, but gave no details."
3.500,Governor Gray Davis estimated yesterday that the fires could cost nearly $2 billion.,State officials estimated the cost at nearly $2 billion.
3.200,The American Express Corp. has pledged at least $3 million of more than $5 million needed.,"The city had requested federal funds, but withdrew that request when American Express pledged at least $3 million."
4.000,"Claudette, the first hurricane of the Atlantic storm season, hit the mid-Texas coast July 15 with 85-mph wind.","Claudette, the first hurricane of the Atlantic storm season, hit the mid-Texas coast July 15, classified as a Category 1 hurricane with maximum sustained winds of 85 mph."
2.000,Results from No. 2 U.S. soft drink maker PepsiCo Inc. (nyse: PEP - news - people) were likely to be in the spotlight.,Wall Street was also waiting for aluminum maker Alcoa Inc. (nyse: PEP - news - people) to report earnings after the close.
3.600,"Taylor's aides warn an abrupt departure could trigger more chaos, a view shared by many in Liberia and, in private, even by mediators.","His aides warn an abrupt departure could trigger more bloodshed, a view shared by many in Liberia."
4.200,"But Odette is the first to form over the Caribbean Sea in December, the Center said.",It is the first named storm to develop in the Caribbean in December.
4.000,The AFL-CIO is waiting until October to decide if it will endorse a candidate.,The AFL-CIO announced Wednesday that it will decide in October whether to endorse a candidate before the primaries.
3.250,"It was developed with consultation from more than 300 leaders in academia, industry, government and the public.","The plan, called The NIH Roadmap, was developed over 14 months with help from more than 300 consultants in industry and academia."
3.400,Local police authorities are treating the explosion as a criminal matter and nothing has been ruled out.,Acting New Haven Police Chief Francisco Ortiz said police were treating the explosion as a criminal matter.
3.667,Chiron already has nearly 20 percent acceptances from PowderJect's shareholders.,Chiron has acceptances from holders of nearly 20 percent of PowderJect shares.
3.750,"""We believe we are fully prepared to roll out the [touch-screen] machines for the 2004 presidential primary,"" said Gilles W. Burger, State Board of Elections chairman.","""We believe we are fully prepared to roll out the revised Diebold machines,"" said Gilles W. Burger, chairman of the Maryland State Board of Elections."
1.200,"Analysts expected earnings of 27 cents a share on revenue of $17.7 billion, Thomson First Call says.","Hewlett-Packard is putting in for a second-quarter profit of $659 million, or 29 cents a share, on revenue of $18 billion."
3.800,Another was in serious condition at Northwest Medical Center in Springdale.,"At Northwest Medical Center of Washington County in Springdale, one child is in serious condition."
3.400,"Sean Harrigan, president of the California Public Employees' Retirement System, also suggested paring down the NYSE's 27-member board, changing its composition and making it more accountable.","Sean Harrigan, president of the California Public Employees' Retirement System, also suggested paring the NYSE's 27-member board and allotting more seats to investors outside the securities industry."
3.200,The Swedish central bank was also meeting on Wednesday and widely expected to announce a cut on Thursday.,"The Swedish central bank, also meeting on Wednesday, is widely expected to announce a cut on Thursday of as much as half a percentage point."
3.600,"His 1996 Chevrolet Tahoe was found abandoned in a Virginia Beach, Va., parking lot June 25.","His sport utility vehicle was found June 25, abandoned without its license plates in Virginia Beach, Va."
3.000,Heatley was sixth in the league in goals last season with 41 and ninth in points with 89.,Heatley led Atlanta in scoring last season with a team-record 41 goals and 48 assists.
1.600,"""Tony's not feeling well,"" Spurs coach Gregg Popovich said.","We're thrilled to be up 3-2,'' Coach Gregg Popovich said Wednesday."
3.200,Electronic Data Systems Corp. Thursday said the Securities and Exchange Commission has asked the company for documents related to its large contract with the U.S. Navy.,"In a regulatory filing, EDS said the SEC had asked for information related to its troubled IT outsourcing contract with the US Navy."
3.800,"As well as the dolphin scheme, the chaos has allowed foreign companies to engage in damaging logging and fishing operations without proper monitoring or export controls.",Internal chaos has allowed foreign companies to set up damaging commercial logging and fishing operations without proper monitoring or export controls.
4.200,The next court session will be when the three-judge tribunal announces its verdict in mid-February.,The court's three-judge tribunal was expected to give its verdict next February.
3.000,The consensus among Wall Street analysts was for a loss of 28 cents a share.,Analysts surveyed by First Call were expecting sales of $723 million and a loss of 28 cents a share.
4.000,"The civilian unemployment rate improved marginally last month -- slipping to 6.1 percent -- even as companies slashed payrolls by 93,000.","The civilian unemployment rate improved marginally last month _ sliding down to 6.1 percent _ as companies slashed payrolls by 93,000 amid continuing mixed signals about the nation's economic health."
4.750,Moffitt said the results need to be replicated in another study before testing of individuals for presence of the long or short versions of the gene will be pursued.,Professor Moffitt said the results needed to be replicated before pursuing testing of individuals for the presence of the long or short versions of the gene.
3.533,The compensation committee will prohibit securities industry directors from sitting on it.,The exchange also said its five-person compensation committee will consist only of directors from outside the securities industry.
1.250,Q: Can I buy coverage for prescription drugs right away?,Congress has added a new benefit - an option to buy insurance coverage for prescription drugs.
4.000,"Shares of Mandalay closed down eight cents to $29.42, before the earnings were announced.",Shares of Mandalay closed down 8 cents at $29.42 Thursday.
3.000,"In 1999, the building's owners, the Port Authority of New York and New Jersey, issued guidelines to upgrade the fireproofing to a thickness of 1{ inches.",The NIST discovered that in 1999 the Port Authority issued guidelines to upgrade the fireproofing to a thickness of 1 1/2 inches.
2.600,"The dollar was last at $1.1149 to the euro, close to its strongest level since April 30.","The dollar pushed as high as $1.1115 to the euro in early trade, extending Tuesday's one percent rally to hit its strongest level since April 30."
3.500,"The single currency rose as far as 135.13 yen , matching a record high hit shortly after the euro's launch in January 1999.","The single currency rose as far as 135.26 yen , its highest level since the introduction of the single currency in January 1999."
1.500,"A New Castle County woman has become the first Delaware patient to contract the West Nile virus this year, the state's Department of Health reported.","A 62-year-old West Babylon man has contracted the West Nile virus, the first human case in Suffolk County this year, according to the county health department."
2.000,He also reaffirmed his wish to resolve the North Korean nuclear crisis peacefully.,But the North Korean nuclear crisis has dominated his time in office.
3.500,"A rebel who was captured said more than 2,000 insurgents were involved in the attack.","A captured rebel said 2,100 combatants had been involved in the offensive."
3.000,"Kyi, a U.N. envoy says, as Japan adds to growing international pressure by saying it will halt its hefty economic aid unless Suu Kyi is freed.","JAPAN added to growing international pressure on Burma yesterday, threatening to halt its hefty economic aid unless the military government released pro-democracy leader Aung San Suu Kyi."
4.750,"Wal-Mart, Kohl's Corp., Family Dollar Stores Inc., and Big Lots Inc. were among the merchants posting May sales that fell below Wall Street's modest expectations.","Wal- Mart, Kohl's Corp., Family Dollar Stores Inc., and Big Lots Inc. posted May sales that fell below Wall Street's modest expectations."
3.400,"Mr Eddington warned yesterday that the future of the airline was ""in the hands of the negotiators"".","""The future of BA is in the hands of the negotiators,"" Eddington told British Broadcasting Corp. television on Sunday."
3.400,"""Both of these kids are in wonderful physical condition right now,"" he said during a press briefing at the hospital.","""Both of these kids are in wonderful physical condition right now,"" said Goodrich, also director of pediatric neurosurgery at the Children's Hospital at Montefiore."
4.250,"On the cell's surface, the foreign components are recognised by other cells that then realise it is infected and kill it.",The foreign bits are recognized by other cells that realize it is infected and kill it.
3.800,Trading in Loral was halted yesterday; the shares closed on Monday at $3.01.,"The New York Stock Exchange suspended trading yesterday in Loral, which closed at $3.01 Friday."
3.000,Knox County Health Department is following national Centers for Disease Control and Prevention Protocol to contain infection.,The health department spokesperson added the department is following Centers for Disease Control protocol.
3.000,"Schools Chancellor Joel Klein said the push for higher standards and accountability ""is showing results.""",Schools Chancellor Joel Klein said he was pleased by the results.
4.600,One witness told Anatolian he saw the plane on fire while it was still in the air.,One witness told the Anatolian news agency he saw the plane on fire in mid-air.
3.000,He proposed a system under which it would take fewer and fewer votes to overcome a filibuster.,Frist proposed a process in which it would take gradually fewer votes to overcome filibusters preventing final votes on judicial confirmations.
4.250,"Hormone replacement therapy that combines estrogen and progestin doubles a woman's risk of breast cancer, a British study of more than a million women has found.","A major British study has added to the evidence that hormone replacement therapy increases the risk of breast cancer, especially when women receive a combination of estrogen and progestin."
1.800,"Barbini's comments came Tuesday, the second day of the Ministerial Conference and Expo on Agricultural Science and Technology.",U.S. Agriculture Secretary Ann Veneman kicks off the three-day Ministerial Conference and Expo on Agricultural Science and Technology on Monday.
2.800,"Yesterday, shares closed up 29 cents, or 0.54 percent, at $54.32.","Amazon's shares yesterday closed at $54.32 on the Nasdaq Stock Market, up 29 cents."
1.250,Lawtey is not the first faith-based program in Florida's prison system.,But Lawtey is the first entire prison to take that path.
3.750,The transaction will grant Handspring stockholders 0.09 of a share of Palm--and no shares of PalmSource--for each share of Handspring common stock.,"Under the proposed terms of the transaction, and following the spinoff of PalmSource, Palm will exchange 0.09 shares for each share of Handspring."
3.750,"The giant rock was first observed on August 24 by Lincoln Near-Earth Asteroid Research Program, based in Socorro, New Mexico.","The rock was first observed by the Lincoln Near Earth Asteroid Research Program, also known as LINEAR."
3.750,"""We need to change old habits and seriously rethink business-as-usual.""","He urged employees to ""avoid complacency"" and to ""change old habits and seriously rethink business-as-usual."""
3.500,"""These despicable acts were committed by killers whose only faith is hate,"" Bush said, adding that the United States will find the killers.",These despicable acts were committed by killers whose only faith is hate and the United States will find the killers and they will learn the meaning of American justice.
4.600,"There are a total of 659 women enrolled at the academy, the report said.",There were 659 women enrolled at the academy at the time of the survey.
3.250,"It is a national concern that will touch virtually every American,"" Abraham said.","The impact of natural-gas shortages ""will touch virtually every American,"" Energy Secretary Spencer Abraham warned yesterday."
1.333,"In the United States, 20.7 percent of all women smoke.","Nevada is where the most women smoke, 28 percent."
2.500,It has a margin of error of plus or minus 4 percentage points.,That poll had 712 likely voters and sampling error of plus or minus 3.7 percentage points.
3.250,"Shares of MONY were gaining $2.57, or 9%, to $31.90 in after-hours trading on Instinet.",MONY shares rose 8.76 per cent to $31.90 in after-hours trading in New York.
3.000,Diana was at her lowest ebb when she wrote the letter to Paul Burrell claiming there was a plot to kill her.,Burrell said Diana wrote a letter in October 1996 claiming there was a plot to kill her in a smash and gave it to him to keep as insurance.
3.600,Gillespie sent a letter to CBS President Leslie Moonves asking for a historical review or a disclaimer.,Republican National Committee Chairman Ed Gillespie issued a letter Friday to CBS Television President Leslie Moonves.
2.200,"""Let's show we won't let them off,"" said Marc Blondel, leader of the Force Ouvriere union.","""The movement to defend pensions is gaining momentum, and we won't give up,"" said Marc Blondel, leader of the Force Ouvriere union."
4.800,"Contrary to what PeopleSoft management would have you believe, Oracle intends to fully support PeopleSoft customers and products for many years to come.""","Ellison said that contrary to the contentions of PeopleSoft management, Oracle intends to ""fully support PeopleSoft customers and products"" for many years to come."
4.000,"Under Mexican law, bounty hunting is considered a form of kidnapping.","Bounty hunting is illegal in Mexico, and the bounty hunter was charged with kidnapping."
3.400,The announcements were made at the International Broadcasting Convention (IBC) in Amsterdam.,"The submission was on Monday, but the announcement was made Friday at the International Broadcasting Convention in Amsterdam."
3.200,Its keywords are supported by Chinese language Web portals.,"Chinese language Web portals also support 3721 keywords, the Web site said."
2.500,The consensus estimate of analysts polled by Thomson First Call called for a profit of $1.70 per share.,"Analysts polled by Reuters Research, a unit of Reuters Group Plc, on average forecast profit of $1.69 per share."
3.250,"Initial autopsy reports show they died of dehydration, hyperthermia and suffocation.","Two more died later, and initial autopsy reports show they succumbed to dehydration, hypothermia and suffocation."
3.800,Authorities appealed to the public Friday to come forward and provide what could be the key to solving the sniper-style shootings that have killed three people outside area convenience stores.,Authorities looked to the public yesterday for help in solving the deadly sniper-style shootings of three people outside Charleston-area convenience stores.
4.400,"Second comes HP (27 percent with $2.9 billion, up just 0.4 percent).",HP fell to second place with server sales growing 0.4 percent to $2.9 billion.
3.500,U.S. forces recently apprehended some 40 suspected foreign militants near the Syrian border and are now interrogating them.,"The Third Armored Cavalry Regiment recently apprehended about 40 suspected fighters near the Syrian border, officials said."
1.500,"That compares with a profit of $1 million, or breakeven, on $1.39 billion in revenue during the same period last year.","Total revenue for the second quarter was $1.48 billion, up 7% from $1.39 billion in the same period last year."
2.800,Bolivia's army fought to stop columns of protesters from streaming into the food-starved capital on Wednesday as a popular uprising against the president spread.,"Bolivia's army fought to stop a column of dynamite-wielding miners from streaming into the besieged capital on Wednesday, leaving two dead as a popular uprising against the President spread."
3.600,"The A920 comes with a printer, scanner, and copier for $89.","Dell's Personal All-in-One A920 is an entry-level device that combines printer, scanner and copier functions for $89."
4.200,"But in the first 30 seconds after Young entered the ring, the family knew it was an uneven match, Meyers said.","But in the first 30 seconds of the bout, family members knew it was an uneven match, Jodie Meyers, Stacy Young's sister, said."
3.000,"Singapore reported no suspected SARS cases Wednesday, but officials quarantined 70 people who had contact with the Taiwanese patient.","Still, Singapore quarantined 70 people who had been in close contact with the scientist."
3.000,"Downstream at Mount Vernon, the Skagit River was expected to crest at 36 feet -- 8 feet above flood stage -- tonight, Burke said.","The Skagit was expected to crest during the night at 38 feet at Mount Vernon, 10 feet above flood stage, the National Weather Service said."
1.600,"On Monday, the Dow declined 5.25, or 0.1 percent, at 8,983.80, having shed 2.3 percent last week.","In early trading, the Dow Jones industrial average was down 39.94, or 0.4 percent, at 8,945.50, having slipped 3.61 points Monday."
4.000,"The injured were taken to hospitals in Jefferson City and Columbia, a college town about 30 miles to the north.","The injured were taken to hospitals in Jefferson City and Columbia, about 48km north; their conditions were not immediately available."
1.333,"The dollar was at 117.85 yen against the Japanese currency, up 0.1 percent.","Against the Swiss franc the dollar was at 1.3289 francs, up 0.5 percent on the day."
3.600,"In addition to O'Connor, Rehnquist's majority opinion was joined by Justices David Souter, Ruth Bader Ginsburg, and Stephen Breyer.","Joining him in the majority opinion were Justices Sandra Day O'Connor, David H. Souter, Ruth Bader Ginsburg and Stephen G. Breyer."
3.000,"Martin, 58, will be freed today after serving two thirds of his five-year sentence for the manslaughter of 16-year-old Fred Barras.",Martin served two thirds of a five-year sentence for the manslaughter of Barras and for wounding Fearon.
3.000,"IDEC shareholders would own 50.5 percent of the stock of the combined company, and Biogen shareholders the remaining 49.5 percent.",The companies said Idec holders would own about 50.5 percent of the stock of the combined company.
3.500,"Nonetheless, the open-source guru insisted, ""This attack was wrong, and it was dangerous to our goals.""","""This attack was wrong, and it was dangerous to our goals,"" Raymond said."
4.000,"Frank Quattrone, the former Credit Suisse First Boston technology investment-banking guru, reportedly pleaded not guilty Tuesday to charges of obstruction of justice and witness tampering.",NEW YORK -(Dow Jones)- Former star investment banker Frank Quattrone pleaded not guilty Tuesday to criminal charges of obstruction of justice and witness tampering.
2.200,"The blue-chip Dow Jones industrial average .DJI fell 86.56 points, or 0.94 percent, to 9,109.99, after giving up more than 1 percent earlier.","The Dow Jones industrial average .DJI fell 79.43 points, or 0.86 percent, to 9,117.12 on Friday."
3.400,"The Dow Jones industrial average ended the day down 10.89 at 9,837.94, after advancing 111.04 Wednesday.","The Dow Jones industrial average fell 10.89 points, or 0.11 percent, to 9,837.94."
3.500,Perry has since called two special legislative sessions to try force the redistricting plan through.,"Since then, Texas Gov. Rick Perry has called two special sessions trying to push the measure through."
4.250,"The agency will ""consider as timely any tax returns or payments due"" Aug. 15 if they are submitted by Aug. 22.",The agency said it would consider as timely any tax returns or payments due from Friday through Aug. 22 if they are completed by Aug. 22.
2.600,Democrats currently hold a 17-15 advantage in the state's congressional delegation.,The Texas congressional delegation now is 17-15 Democratic.
3.000,"Chaudhry was released 56 days later and the Fiji military installed an all-indigenous government led by Qarase, who won democratic elections in September 2001.","The Fijian military installed an all-indigenous government led by Mr Qarase, who won democratic elections in September 2001."
2.400,New legit download service launches with PC users in mind.,BuyMusic is the first subscription-free paid download music service for PC users.
3.800,"The 30-year bond US30YT=RR rose 22/32 for a yield of 4.31 percent, versus 4.35 percent at Wednesday's close.","The 30-year bond US30YT=RR grew 1-3/32 for a yield of 4.30 percent, down from 4.35 percent late Wednesday."
3.000,"Last week, his lawyers asked Gov. Mark R. Warner to grant clemency, but the governor declined to intervene.","Last week, his lawyers asked Warner to grant clemency under certain conditions that would have lead to a new sentencing hearing."
3.500,Gov. Linda Lingle and members of her staff were at the Navy base and watched the launch.,Gov. Linda Lingle and other dignitaries are scheduled to be at the base to watch the launch.
3.500,"The best the investigators can do is nitpick about the process and substance of isolated business decisions ... and question his competence as a manager.""","Ebbers' lawyer, Reid Weingarten, said despite the thorough investigation, ""the best the investigators can do is nitpick about the process and substance of isolated business decisions."""
3.750,"The Justice Department filed suit Thursday against the state of Mississippi for failing to end what federal officials call ""disturbing"" abuse of juveniles and ""unconscionable"" conditions at two state-run facilities.","The Justice Department filed a civil rights lawsuit Thursday against the state of Mississippi, alleging abuse of juvenile offenders at two state-run facilities."
2.250,The Chelsea defender Marcel Desailly has been the latest to speak out.,"Marcel Desailly, the France captain and Chelsea defender, believes the latter is true."
3.250,She was the only woman in her unit and a member of Teamsters Local 995.,She was the only woman employed as a warehouse worker and heavy equipment operator and the only woman in her Teamsters local.
4.800,"Special police detained Khodorkovsky early on Saturday in the Siberian city of Novosibirsk, where his plane had made a refuelling stop.",Police detained Khodorkovsky early on Saturday when his jet made a refueling stop in the Siberian city of Novosibirsk.
3.800,"Sony Ericsson also said it would shut down its GSM/UMTS R&D center in Munich, Germany, to increase profitability.","Sony Ericsson also said it plans to close its R&D site in Munich, Germany, for GSM and UMTS handsets."
3.400,But the country is scrambling to prevent it spreading to the vast countryside where most of its 1.3 billion people live.,"China is scrambling to stop the disease from spreading to the countryside, where most of its 1.3 billion people live."
2.000,Kansas Department of Health and Environment records show there were 88 abortions performed on girls age 14 and younger last year.,"Statistics from the Kansas Department of Health and Environment show that 11,844 abortions were performed in the state last year."
4.600,"""The discovery that the MAP bug is present in the vast majority of Crohn's sufferers means it is almost certainly causing the intestinal inflammation,"" it said in a statement.",The researchers say that the fact the MAP bug is present in the vast majority of Crohns sufferers means it is almost certainly causing the intestinal inflammation.
3.500,"The life expectancy for boys born in 2001 was 74.4 years, up two years since 1990.","According to the report, average life expectancy has increased by nearly two years since 1990."
3.333,"For the full 12-month period, high-speed cable modem connections increased by 49 percent.","For the full year period ending June 30, 2003, high-speed lines increased by 45 percent."
2.667,We believe the report is fully consistent with what the courts have ruled ... that the department's actions are fully within the law.,Comstock said several federal courts have ruled that the detentions are fully within the law.
3.200,"Indeed, Mr. Weill, a self-described workaholic, said he planned to remain very involved in the company.","Still, Mr. Weill will remain very much a power at the company."
3.800,"Gregory Parseghian, a former investment banker, was appointed chief executive.",Greg Parseghian was appointed the new chief executive.
3.400,"The report cites the marriage of the alleged operational commander of the Bali bombings, Mukhlas, to Farida, a ""highly cosmopolitan and well-educated young woman"".","The report cites the marriage of the alleged operational commander of the Bali bombings, Mukhlas, as an example of how JI uses marriage to grow."
3.400,The Cradle of Liberty Council isn't the first one to buck the national group's stance.,Philadelphia's council is not the first to defy the national policy.
