2.2,European markets rise on Greek bailout hopes,European Ministers Are Poised to Approve Greek Rescue
4.6,"Edwards Acquitted on 1 Count, Mistrial on Others",Edwards found not guilty on one count; mistrial on others
4.2,Ukrainian weightlifter gets four-year doping ban,Ukraine's Korobka gets four-year doping ban
3,Gunman may have filmed school massacre,Killer may have filmed France school shooting
1.6,Hong Kong stocks close down 0.28%,Hong Kong stocks open 0.62 pct higher
0.8,Suicide bomber attacks Algerian security base,Suicide bomber targets Nigerian church
1,Thailand: Iranians planned to attack Israelis,Malaysia to extradite Iranian for attack on Israelis
1.2,Israeli military court rejects appeal of Palestinian hunger striker,Israel reaches deal with Palestinian hunger strikers
1.6,Avengers sets box office record,'Hunger Games' sets box office records
4.2,Putin 'Wins Russian Presidential Election',Putin 'wins' Russia's presidential election
1.4,Putin casts ballot as Russians vote,Putin to win Russia's presidential election
4.8,"UN Chief Finds His Voice, Remains Cautious on China","Insight: U.N. chief finds his voice, but remains cautious on China"
3.2,Libyans begin handing in weapons,Libyans transfer weapons to army
2.4,British Archbishop of Canterbury changes career to Cambridge,Archbishop of Canterbury to step down amid rifts
4.2,"Punjab Mail derails near Rohtak, 19 injured","Punjab Mail derails near Rohtak in Haryana, 19 injured"
4,George Zimmerman 'to be charged' with killing Trayvon Martin,"George Zimmerman to be charged in Trayvon Martin case, official says"
3.8,Indian Maoist rebels offer talks to free Italian hostages,India: Maoist rebels in talks on freeing Italians
2.8,Two reported dead in shooting at Empire State Building in NY,City Room: Empire State Building Shooting
1,Five dead in Pakistan suicide blast,At least 63 dead in Pakistan factory blaze
2.4,Penn State football players react to sanctions,Penn State football slammed with NCAA sanctions
0.5,Israel must release or try Palestinian on prolonged hunger strike,Israeli minister wants Palestinian leader's ouster
1,UN report says both sides in Syria abuse rights,NATO leader plays down risk of Turkey-Syria clash
3.2,Girl accused of burning Koran goes into hiding,Girl accused of burning Koran bailed
2.2,France warns Syria over chemical weapons use,U.N. concerned at possible Syria chemical weapons
4.4,Life-threatening Midwest storms feared,'Life-Threatening' Storms Feared for Midwest
0.8,Chicago teacher strike nears end with 'framework' agreement in place,"General strike ends: Histadrut, Treasury reach agreement"
1.4,Indonesian president to visit UK,Indonesian president to visit Australia
4.4,Storm delays start of Republican convention,"Storm lashes Florida, delaying Republican convention"
0.8,At least two Nato killed in Afghanistan helicopter crash: military,At least 18 killed in Afghan bomb attacks: officials
2.6,President Mills must quit - Lecturer,President John Evans Atta-Mills Must Resign Now -NPP Germany
5,Miami Heat wins NBA Finals,Miami Heat clinches NBA Championship
4.2,Japan closes last nuclear reactor,Japan switches off last nuclear power plant this weekend
1.2,Ryanair in new bid for Aer Lingus,Ryanair chief hails report findings
4.4,Russian Air Force celebrates 100th anniversary,Russian air force's 100th anniversary
2.2,6 NATO troops killed in Afghanistan,NATO Soldier Killed in Afghanistan
1.6,Not so Super Tuesday for Mitt Romney,Romney leads Santorum in GOP Super Tuesday contests
2.4,Putin sworn in as Russian growth falters,Putin sworn in as Russia's president for 6 years
3.4,"ArQule, Daiichi stop lung cancer trial, shares tank",ArQule stock plunges as lung cancer study shelved
1.6,Teenager and father killed in crash,Three killed in horror crash are named
4.2,6.1-magnitude quake strikes Indonesia,"6.1-magnitude quake hits Papua, Indonesia -- USGS"
4.2,2 Americans Killed as Afghan Unrest Enters Fifth Day,Two American Officers Murdered As Afghan Unrest Continues
0.6,Officials: Romney to get Secret Service protection,Obama addresses Secret Service scandal
1,Japan PM calls for quicker tsunami waste processing,Japan marks one year since quake and tsunami disaster
1.4,Syrian fighter pilot defects to Jordan,Syrian PM defects to Jordan
1.2,Syrian Arab Republic (the): Syrian Arab Republic: Syrian Refugees (as of 28 June 2012),Syrian Arab Republic (the): More than 70 killed in Syria ahead of Annan return
1.2,Suicide bomber kills 16 in Afghanistan,Suicide bomber kills 12 in Nigeria church
3.2,Airlines cancel 'flytilla' activists' tickets to TA,UK Airline Cancels 'Flytilla' Tickets on Israel Objections
0.2,Spain asks for bank rescue,Spaniard on trial for Cuban dissident’s death
1.4,The murky waters of the South China Sea,Peace lies over the South China Sea
0.6,Sri Lanka seek one-day revival against Pakistan,Senior journalist killed in Pakistan
3.8,"SpaceX docks with International Space Station: Up next, public travel?",SpaceX Dragon Docks With International Space Station
4,'Million Muppet March' to defend Obama backing of PBS,Million Muppet March planned to defend U.S. backing for PBS
1.4,Syrian opposition in reconciliation talks,Syrian Opposition Council to Establish Envoy in France
1,Sensex down 193 points on budget blues,Romney won't volunteer budget differences
3.6,Facebook boosts size of IPO by 25pc to raise $15bn,Facebook boosts size of IPO by 25 percent
4,Iran's Parliament Questions A Dismissive Ahmadinejad,Iran's parliament questions President Ahmadinejad
1.6,Yemen suicide attack kills 7 soldiers: officials,Afghan suicide car bomb kills at least seven: officials
0.8,Presidential vote polarises Egyptians,GOP presidential hopefuls clash in Southern races
1.8,Three more US soldiers killed in Afghanistan,NATO Soldier Killed in Afghanistan
0.4,Police raise death toll in bus accident to 8,Rodney King death ruled accidental
0.8,Four foreign soldiers killed in Afghan east,2 British soldiers killed in Afghan insider attack
3.6,Red Cross worker killed in Pakistan,British Red Cross doctor kidnapped in Pakistan found beheaded
3.8,"Afghan, US govts sign deal on controversial night raid","Afghans, US sign deal on night raids"
1.6,China mine accident kills 10,China truck accident kills 20
0.4,Australia can eclipse England in Windies,Australian PM defiant under pressure over leadership
3.4,Protests at Pussy Riot verdict,Pussy Riot verdict greeted with defiance
2.2,Secret Service sees its 'biggest scandal' over prostitutes,Secret Service sex scandal 'regret'
3.4,Kuwait: Activists storm Syrian embassy; two injured,Activists storm Syria embassy in Kuwait
3.4,Details of Aung San Suu Kyi's visit to Ireland,Rapturous welcome for Aung San Suu Kyi's historic trip
2.2,Key says marae visit a lost opportunity,Key wants Waitangi marae visit to stay
3.8,Norway marks anniversary of massacre,Norway Marks Anniversary of Breivik's Massacre
0,Woman killed by falling debris,When an ally declines
1,Aust shares up 1% after interest rate cut,RBA delivers another rate cut
2.6,Germany warns Greece: No more money without reforms,Euro zone to Greece: No rescue without reforms
3.2,Obama to meet families of shooting victims,Obama to meet Batman gun victims
1,Obama widens lead over Romney despite jobs data: Reuters/Ipsos poll,"Romney takes lead over Obama with convention ""bounce"": Reuters/Ipsos poll"
1.4,"Two killed, 19 injured in Toronto shooting","Two dead, 7 injured in Finland shooting"
3.4,What the Pope's butler saw – aide arrested over Vatican leaks,Pope’s butler arrested in scandal over Vatican leaks
3.8,Anti-Putin protesters form human chain in Moscow,Anti-Putin protesters form human chain
2.6,Washington's Acts of Congress sells for $9.8M,George Washington's copy of US Constitution sells for $9.8m
4.4,Lakers Fire Coach Mike Brown After 1-4 Start,Lakers fire Mike Brown after 1-4 start
3.4,Canadian Muslims issue fatwa against 'honor killing',"US, Canadian imams issue fatwa against honour killings"
3.6,U.N. to take up Syria resolution,UN Assembly to Vote on Syria Resolution
4.4,Soldier 'can't recall' massacre,US soldier ‘doesn’t recall massacre’
1.2,Libya PM names new cabinet after protests over original,"Libyan assembly rejects new cabinet, dismisses PM"
3.8,4 foreign soldiers killed in Afghan east,4 French Soldiers Reported Killed in Afghanistan
2.5,Syrian forces storm central town,"Syrian forces bombard Homs, Russia warns of civil war"
2.2,Pak: 20 dead in anti-Islam film protests,"25 injured in anti-Islam film protest in Islamabad, Pakistan"
1.8,Cause of Whitney Houston's death could take weeks,Investigators seek answers to Whitney Houston's death
3.6,N Korea warns of retaliation for South Korea drill,North warns of retaliation for Seoul's naval drill plan
1.4,A Tale of Two Passes: How The New York Giants Won The Super Bowl,Lesser of two evils triumphs in Super Bowl
3.6,One dead in new Israeli strike on Gaza,Two killed in new Israeli strike on Gaza: medics
1,Germany Likely to Press Russia on Syrian Crisis,What is Russia thinking on Syria? A brief guide
3.6,Four seriously injured in M23 motorway crash,Four injured in motorway crash
2,UN aid chief Amos enters Baba Amr with Red Crescent,"Syria's besieged Baba Amr is deserted, Red Cross says"
1,Dozens killed in Nigerian riots,Dozens killed in Kenyan clashes
1.2,Profiles of Egypt's main presidential candidates,Second day of Egyptian presidential election
4.4,Actor Gazzara dead at 81,Actor Ben Gazzara dies at 81
0.6,British gold rush silences gripes over cost,2 British soldiers killed in Afghan insider attack
4.6,Avalanche buries at least 100 Pakistani soldiers,Avalanche buries over 100 Pakistani soldiers
4.6,Inflation falls to 15-month low: what the analysts say,Inflation falls to 15-month low
3,Komen won't cut Planned Parenthood funding,Susan G Komen in U-turn over Planned Parenthood funding cut
2.2,Forex &amp; Gold 25 August 2012,Forex & Gold 19 July 2012
2.8,Iran says UN nuclear talks will continue,Iran says nuclear talks with UN 'constructive'
4.2,Agribusiness: Mad cow disease found in California,USDA Confirms Case of Mad Cow Disease in California
3.6,BP sells some Gulf of Mexico assets for $5.55 bil,BP sells Gulf of Mexico assets to Plains for $5.55 bn
3.6,300 potential Jimmy Savile victims: police,UK: 300 potential Savile abuse victims emerge
4.6,Armstrong steps down from Livestrong,Armstrong standing down from Livestrong
1.8,US drone strike kills 5 militants in Pakistan,U.S. drone strikes kill 16 suspected militants in Yemen
1,Syrian govt wont stop attacks,Syrian opposition reports 'massacre'
4.6,Chinese stocks close higher midday Friday,Chinese stocks higher at midday Friday
3.2,Myanmar: Opposition claims Suu Kyi win,Voters in Myanmar hopeful as Suu Kyi's party claims win
1,Obama's poll rating drops in boost for Republican rivals,Obama's big Hispanic win worries Republicans
1.2,Two Aust soldiers wounded in Afghanistan,4 foreign soldiers killed in Afghan east
1,New Syria opposition chief wants no-strings aid,Syria opposition unites as Israel fires warning shots
0.8,South Africa mine clash kills at least 30,South Africa train crash kills 26
2.6,"Syrian forces bombard Homs, Russia warns of civil war","Syrian forces bombard Homs, Lavrov arrives for talks"
4.2,Egypt presidential election results delayed,Egyptian election result delayed
1.6,Deadline passes with no new Iran sanctions,EU Moves Closer to New Iran Sanctions
0.8,Arrested Russian killer denies ties to Pussy Riot,Dozens arrested in Russian TV tower protest
2.8,Norway memorial honours 77 massacre victims,Norway marks anniversary of massacre
3.8,US Afghanistan general linked to Petraeus scandal,Senior US general linked to Petraeus scandal
2,Chinese stocks fall after RRR cut - May 14,Chinese stocks gain at midday Monday
2.8,"NKorea makes ""significant"" nuclear reactor progress - IAEA",N. Korea vows to expand nuclear deterrent
3.4,"Maldives president quits after police mutiny, protests",Maldives president quits after weeks of protest
0.8,NATO strike 'kills civilians' in Afghanistan,Two NATO soldiers killed in Afghanistan
1.4,Al-Qaida says it captures 70 Yemeni soldiers in Abyan's battle,"Al Qaeda clashes, blasts kill 35 soldiers in Yemen"
3.4,"Navy jet crashes into US apartments, pilots eject",U.S. Navy Jet Crashes Into Virginia Apartment Buildings
0.8,China stocks open higher Wednesday,US stocks open higher despite GDP miss
0,IDF to deploy Iron Dome in Central Israel,Major snowstorm barrels down on Central Plains
3,4 Killed in US Drone Strike in Pakistan,U.S. Drone Strike Kills 3 in Pakistan
3.4,US teen held in Chicago 'jihad' car bomb plot,Chicago teen arrested in Chicago car bomb plot
0.2,PC David Rathband: twin brother's fears for his 'bestest mate',David Miliband: my brother and a return to old Labour
4.4,Syrian forces move to retake Aleppo,Syrian Regime Bids To Retake City Of Aleppo
0,"20-member parliamentary, trade team leaves for India",Commerce secretary to take leave of absence
2,Wall Street Opens Lower,Wall Street Ends Mixed
0.8,Europe shares bounce as more China stimulus seen,Oil prices rise on hopes for stimulus
4.4,Stock index futures point to lower start,Stock index futures signal early losses
1.4,Man charged after MP hurt in attack,Man charged with murder in flat
0,Nokia apologises for 'faked' ad,US waives riders for Pak aid
3,US drone strike kills 5 militants in Pakistan,Drone strike kills four suspected militants in Pakistan
4.4,Syria rebels leave besieged Homs,Syrian rebels retreat from besieged Homs district
4,"U.S. orders non-essential staff to leave Sudan, Tunisia","US orders non-essential staff to leave Tunisia, Sudan"
4.6,Egypt's Mubarak critical,Egypt's Mubarak in critical condition
3.33333333333333,Assad says mercenaries are behind Syria unrest,Assad Accuses US of Fueling Syrian Uprising
0,Japan PM dissolves lower house for election,Iran and world powers set for nuclear talks
2,Two killed in new Israeli strike on Gaza: medics,"5 die in strikes on Gaza, militants barrage Israel"
3.2,"Navy jet crashes into Virginia buildings, injuring six","Navy jet crashes into Virginia apartments,9 hurt"
3.2,One NATO soldier killed in S. Afghanistan,British soldier killed in southern Afghanistan
4.2,Spain jobless rate hits new high,Spain's jobless claims hit new high
3.6,Turkey scrambles jets near border,Turkey scrambles jets to Syrian border
0,Two die in Syria violence after UN monitors land,Two year doping ban for Contador
1,"Civilian, defector killed in Syria, says NGO",Syria gunmen kill three Syrian officers: NGO
1.2,Taiwan rattled by strong earthquake,China rocked by twin earthquakes
2.8,Bank of England's Paul Tucker tainted by Libor mess,Bank of England deputy denies ordering rate-rigging
4.4,Red Cross says negotiating halt to fighting in Syria to take aid,Red Cross negotiating Syria ceasefire to bring aid
0.8,Syrian forces shoot civilians on bus,"Syrian forces, rebels clash near Turkey"
4.4,German parliament overwhelmingly backs Greek rescue deal,German parliament endorses Greek bailout
3.4,"Bombings, clashes continue in Syria","Bombings, clashes as Syria opposition seeks arms"
2.4,Burma's reforms bring easing of U.S. sanctions,Burma activists say go slow on easing sanctions
0.2,Usain Bolt wins 200m – Steven Howard reaction,Facebook mobile gains drive revenue growth: reaction
0.4,Dozens dead in Taliban resort attack,'India police name 3 Iranians in embassy attack'
3.8,Heavy fighting rocks eastern Syria ahead of poll,Heavy fighting rocks eastern Syria - residents
2.8,China yuan weakens to 6.3282 against USD Monday,China yuan retreats to 6.2697 against USD Thursday
1.4,7 dead in Christian school shooting,5 wounded in Ohio school shooting
3.2,Indonesia anti-terror squad kills two suspected militants,Indonesia police shoot dead suspected militants in Bali
4,US Election: Mitt Romney concedes defeat as Barack Obama wins second term,Romney concedes election to Obama in phone call
3.2,Armenians vote in parliamentary elections,Armenia's parliamentary vote a test for president
1.6,Sachin Tendulkar is sworn in as Indian senator,MP Sachin Tendulkar says no to govt bungalow
3.6,Navy Jet Crashes Into Apartment Building,U.S. Navy Jet Crashes Into Virginia Apartment Buildings
1.5,Romney wins big in Puerto Rico primary,Romney wins Illinois primary
4.2,Yahoo! to name Google's Mayer as CEO: report,Yahoo names Google exec Mayer as CEO
2,US soldier accused of Afghan massacre hires prominent criminal lawyer,US soldier accused of killing Afghan civilians identified
1.6,6.0-magnitude quake hits northern Italy: USGS,"5.9-magnitude quake hits Sunda Strait, Indonesia: USGS"
4.4,US gov't officially designates Haqqani network as terrorists,US designates Haqqani network as terrorists
3,Motor Racing: Button fastest in year's first F1 practice,Button boasts best time after first practice
4.8,Rangers voted into Division Three,Rangers voted into third division
4.2,Newark mayor saves neighbor from fire,Newark mayor rescues neighbor from burning house
2.25,F1 protests in Bahrain,A day of rage in Bahrain
3,New York Stock Exchange to reopen Wednesday,DealBook: Stock Exchanges Prepare to Open
2.6,Homs mortar fire kills 105,Homs offensive kills 200
2,Hundreds honor student killed in Ohio shooting,Funeral set for Ohio shooting victim
3,"Bombs in southern Thailand kill 5, wound 50","Bombs in Thailand kill 14, wound 340"
0.2,US lawmakers take next step on new Iran sanctions,Somalia lawmakers to vote for new president
0.4,Barack Obama admits US has 'more nuclear weapons than we need',French gunman wants to 'die with weapons in hands'
1.8,2 rockets hit in the Eshkol region; no injuries,10 rockets in 20 minutes in Eshkol Regional Council
0.6,'Betrayed' disabled workers protest against Remploy closures,May Day marked by protests against austerity cuts
4,DR Congo rebels kill park rangers,Rebels kill two park rangers in eastern Congo
0.8,Nine Pakistani troops killed in militant ambush,"Trade: Pakistan, India agree to take it a step ahead"
3.2,74 dead in Egypt soccer violence,At least 73 die in Egyptian soccer pitch invasion
0.2,Unrest in tense Nigeria leaves at least 95 dead,Southwest China quakes kill at least 50
3,Hurricane Sandy makes landfall in southeastern Jamaica: NHC,Hurricane Sandy reaches Jamaica
1.5,Remarks With Prime Minister Elkeib After Their Meeting,Remarks With Foreign Minister Koichiro Gemba
1.2,Barrick in talks with China firm over African assets,Obama aide holds talks in China after Syria veto
3,Mall attackers used 'less is more' strategy,"In Kenya, attackers used 'less is more' strategy"
3.8,Weak earnings drag stocks lower,Weak earnings drag stocks lower on Wall Street
3.2,6.8 quake strikes off Solomon Islands,Magnitude 6.3 quake strikes off Solomon Islands: USGS
4.6,Liquid ammonia leak kills 15 in Shanghai,Liquid ammonia leak kills at least 15 in Shanghai
4,Friends of Syria recognizes opposition coalition as legitimate representative of Syrian people,"U.S., Friends of Syria recognise opposition as sole representative"
3,Weiner stays in NYC mayor's race amid new sexting scandal,Weiner shrugs off latest online sex scandal
0,Death toll rises in Russia plane crash,Death toll rises to 39 in Italy coach crash
2.8,Indian media: Commonwealth summit,Indian PM snubs Commonwealth summit
5,Syria military police chief defects to opposition,Syria military police chief defects to rebels
4.6,Boeing 787 Dreamliner catches fire; stock takes a beating,Boeing stock tumbles after fire on 787 Dreamliner
2.6,Yvette Cooper backs gay marriage bill,White House backs gay marriage
3.8,Five killed in Belgian coach crash,Teenagers among 5 dead in Belgian bus crash
3.4,Gunmen abduct seven foreign workers in Nigeria,Seven foreign workers kidnapped in Nigeria
5,Swiss tourist 'gang-raped' in India,"Swiss tourist gang raped in India, say police"
4.2,"Palestinians clash with Israeli forces in West Bank, Jerusalem",Palestinians clash with security forces in W. Bank
4.6,Israel planes strike inside Syria,Israel launches airstrike into Syria
0.4,Iranians Vote in Presidential Election,Keita Wins Mali Presidential Election
2.8,100 killed in new Darfur tribal clashes,'9 Dead' in New Darfur Tribal Clash
1.4,Protest against US drone strikes in Pak postponed,6 killed in U.S. drone strike in NW Pakistan
3.2,12 killed in bus accident in Pakistan,10 killed in road accident in NW Pakistan
5,Carney sets high bar to change at BoE,Carney sets high bar to changes at Bank of England
2.4,8 arrested after deadly Bangladesh building collapse,Four arrested as Bangladesh building toll rises to 352
2.8,Suicide bomber kills 3 at US base in Afghanistan,Suicide bombers attack US base in Afghanistan
0.6,"Afghans flock to colleges, even as Taliban loom",Afghan District Governor Defects To Taliban
5,North Korea Postpones Family Reunions with South,North Korea 'postpones' family unions with South Korea
0.6,"Apple revenue misses again, iPhone disappoints","U.S. trade agency rules for Samsung, bans iPhone 4 imports"
3.4,Gunmen kill 10 foreign tourists in northern Pakistan,Gunmen kill 11 foreign climbers in Pakistan
4.4,David Beckham Announces Retirement From Soccer,David Beckham retires from football
4,Matt Smith to leave Doctor Who after 4 years,Matt Smith quits BBC’s Doctor Who
0,Generations divided over gay marriage,G20 Summit ends divided over Syria
1.6,23 killed in Iraq car bombings,10 killed in Iraq bomb attack
5,Man Who Set Himself on Fire on National Mall Dies of Injuries,Man 'who set himself ablaze' on National Mall dies
1.4,Taliban attacks kill 17 civilians in Afghanistan,Series of attacks kill 10 police in Afghanistan
1.6,Egypt minister survives assassination attempt,Syrian prime minister 'survives assassination attempt'
4.6,Ex-first lady Barbara Bush leaves Texas hospital,Former first lady Barbara Bush leaves hospital
4,Schumacher in a coma after ski accident,Michael Schumacher still in a coma fighting for his life following skiing accident
5,11 killed in Chinese police station attack,Eleven killed in China police station attack
4,Bradley Cooper and JJ Abrams in talks about filming a Lance Armstrong biopic,Bradley Cooper in talks to play Lance Armstrong in biopic
3.8,"Boeing airliner crashes in Russia, 50 killed","Boeing airliner crashes in Russian city of Kazan, 50 killed"
4.4,EU ministers 'determined' to resolve horsemeat scandal,EU ministers hold crisis talks over horse meat scandal
4.8,Thai opposition party to boycott general election,Thai opposition announces election boycott
2.6,Bangladesh building collapse death toll hits 540: army,"Bangladesh building collapse death toll passes 1,000"
4.2,"Jagan Reddy shifted to hospital, power crisis continues in Seemandhra",Telangana: Jagan to spend Thursday in hospital; blackout continues in Seemandhra
2.6,Central African Republic president overthrown by rebels,"Central African Republic President, PM stepping down"
5,Brazil tied 2-2 by England as Maracana re-opens,Brazil held by England 2-2 as Maracana re-opens
3.8,"California wildfire: 1,900 on the lines as firefighters labor to limit damage (+video)",California wildfire grows but officials say fire crews making progress
3,George W. Bush warns against bitter immigration debate,George W Bush weighs into immigration debate
3.4,"Mandela hospitalized, responding to treatment",Mandela hospitalised after he stops talking
1.2,Russia condemns North Korean nuclear test,South Korea confirms that North Korea has conducted controversial third nuclear test
4.4,Hundreds of Bangladesh clothes factory workers ill,Hundreds fall sick in Bangladesh factory
2,Yemen suicide bombing kills soldiers,Female suicide bomber kills 16 at Russian station
2.8,18 trapped in Russian coal mine blast,Ten killed in Russia coal mine blast
4.6,Thai protesters break into army headquarters,Thai protesters storm army headquarters
4.4,Israel conducts airstrike on Syria,Israel launches new airstrike against Syria
2.2,Police fire tear gas to disperse protesters in Tunis,Police fire tear gas at protesters in Cairo
3.8,Egypt's main opposition rejects president's call for dialogue,Egypt opposition mulls response to Morsi dialogue call
1.4,Tokyo to host 2020 Olympic Games,Wrestling to feature in 2020 Tokyo Olympics
4.6,Housing starts up 6.8% in May,May Housing Starts Up 6.8%
5,&gt;Cuba's Castro assumes CELAC presidency,Cuba's Castro to Take Over CELAC Presidency
0.2,6.9 magnitude earthquake hits New Zealand,5.6 magnitude earthquake shakes Iran
3,Dozens feared trapped in India building collapse,Rescuers race to find 20 still trapped in India building collapse
1.2,Daily Press Briefing: South Sudan,Daily Press Briefing: Syria
3.2,Islamists attack north Mali city after suicide bombings,Islamists attack Malian troops in Gao
2.2,Britain set to deport of Abu Qatada,Britain loses bid to deport radical cleric Abu Qatada
0.8,French parliament backs reform of law on prostitution,Russian parliament to consider ban on U.S. adoptions
2.6,"Shots, Explosions Heard as Thais Continue Protest in Bangkok","Gunshots, explosions rock Thai protest day ahead of polls"
1.6,Israeli military focuses on northern border,"Egypt's military takes control over Muslim Brotherhood, supporters"
1,North Korea blocks Kaesong access,North Korea vows to restart nuclear facilities
0.4,Manning sentenced to 35 years in prison,"Ariel Castro sentenced to 1,000 years in prison"
3.4,US Senate approves fiscal cliff deal,"It's official: Deal reached on ""fiscal cliff"""
5,"Zimmerman stopped for speeding in Texas, released with warning","Zimmerman pulled over in Texas for speeding, given warning"
1.4,Iran's Rouhani warns of Talibanisation in Syria,"Russia, China Concerned About Israeli Airstrikes in Syria"
0,Syria denies reports of deadly Damascus nerve gas attack,US allies get help to repel Iranian computer attacks
3.4,China stocks close higher after economic meeting,China stocks close higher on Wednesday
3.4,Russia unveils $30 billion oil link to Pacific,Russia unveils $25bn oil link to Pacific
